{
    "$schema": "http://json-schema.org/draft-04/schema#",
    "type": "object",
    "properties": {
        "title": { "type": "string" },
        "logo": { "type": "string" },
        "home-page": { "type": "string" },
        "options": {
            "type": "object",
            "properties": {
                "verbose": { "type": "boolean" },
                "legacy-mode": { "type": "boolean" }
            }
        },
        "default": {
            "type": "object",
            "properties": {
                "template": { "type": "string" },
                "verbose": { "type": "boolean" },
                "input-root": { "type": "string" },
                "input": { "type": "string" },
                "input-glob": { "type": "string" },
                "sort-by-file-path": { "type": "boolean" },
                "sort-by-variable": { "type": "string" },
                "sort-by-title": { "type": "boolean" },
                "output-root": { "type": "string" },
                "output": { "type": "string" },
                "title": { "type": "string" },
                "title-from-variable": { "type": "string" },
                "code-from-variable": { "type": "string" },
                "no-css": { "type": "boolean" },
                "link-css": { "type": "array", "items": { "type": "string" } },
                "include-css": { "type": "array", "items": { "type": "string" } },
                "page-flows": { "type": "array", "items": { "type": "string" } }
            }
        },
        "documents": {
            "type": "array",
            "items": {
                "type": "object",
                "properties": {
                    "input-root": { "type": "string" },
                    "input": { "type": "string" },
                    "input-glob": { "type": "string" },
                    "sort-by-file-path": { "type": "boolean" },
                    "sort-by-variable": { "type": "string" },
                    "sort-by-title": { "type": "boolean" },
                    "output-root": { "type": "string" },
                    "output": { "type": "string" },
                    "title": { "type": "string" },
                    "title-from-variable": { "type": "string" },
                    "code": { "type": "string", "pattern": "^[\\w\\d_]+$" },
                    "code-from-variable": { "type": "string" },
                    "template": { "type": "string" },
                    "link-css": { "type": "array", "items": { "type": "string" } },
                    "include-css": { "type": "array", "items": { "type": "string" } },
                    "no-css": { "type": "boolean" },
                    "add-link-css": { "type": "array", "items": { "type": "string" } },
                    "add-include-css": { "type": "array", "items": { "type": "string" } },
                    "page-flows": { "type": "array", "items": { "type": "string" } },
                    "add-page-flows": { "type": "array", "items": { "type": "string" } },
                    "verbose": { "type": "boolean" }
                }
            }
        },
        "plugins": { "type": "object" }
    },
    "required": [ "documents" ]
}
