{
    "options": {
        "verbose": false
    },
    "default": {
        "template": "test_input/PageFlowsPlugin/template_new_syntax.html",
        "verbose": false,
        "link-css": ["../doc/layout/styles.css"]
    },
    "documents": [
        {"input": "page1.txt", "output": "new_syntax/page1.html", "title": "Page 1", 
            "page-flows": ["page_flow_1"]},
        {"input": "page2.txt", "output": "new_syntax/page2.html", "title": "Page 2", 
            "page-flows": ["page_flow_2"]},
        {"input": "page3.txt", "output": "new_syntax/page3.html", "title": "Page 3", 
            "page-flows": ["page_flow_1", "page_flow_2"]}
    ],
    "plugins": {
        "page-flows": {
            "page_flow_1": {"groups": ["group1"]},
            "page_flow_2": { "title": "Page flow 2", "groups": ["group1"], "items": [
                {"link": "https://www.google.com/", "title": "Google", "external": true}
            ]},
            "page_flow_3": { "title": "Page flow 3", "groups": ["group1"], "items": [
                {"link": "https://en.wikipedia.org/", "title": "Wikipedia", "external": true,
                    "custom_string": "custom string value", "custom_number": 101.4, 
                    "custom_boolean": true}
            ]}
        }
    }
}
